{
  "workflow": {
    "maxRounds": 3,
    "roundTimeoutMs": 60000,
    "concurrency": 6,
    "agentRetries": 1
  },
  "reviewer": {
    "maxFindings": 6,
    "perspectives": ["correctness", "security", "performance", "api-contract", "tests"]
  },
  "reconciler": {
    "minSeams": 3,
    "maxSeams": 12
  },
  "synthesis": {
    "followUpThreshold": 4
  }
}
